,name,Age,Overall rating,Potential,Team & Contract,ID,Height,Weight,Best overall,Best position,Growth,Value,Wage,Release clause,Total attacking,Crossing,Finishing,Heading accuracy,Short passing,Volleys,Total skill,Dribbling,Curve,FK Accuracy,Long passing,Ball control,Total movement,Acceleration,Sprint speed,Agility,Reactions,Balance,Total power,Shot power,Jumping,Stamina,Strength,Long shots,Total mentality,Aggression,Interceptions,Att. Position,Vision,Penalties,Composure,Total defending,Defensive awareness,Standing tackle,Sliding tackle,Total goalkeeping,GK Diving,GK Handling,GK Kicking,GK Positioning,GK Reflexes,Total stats,Base stats,International reputation,Pace / Diving,Shooting / Handling,Passing / Kicking,Dribbling / Reflexes,Defending / Pace,Pied droit
186409,"M. Carayol, Mustapha Carayol",35,61 ,61 ,2025,186450,177,75,,RW,,130000,5000,,,61,52,24,57,43,,61,55,62,52,60,,74,79,75,60,73,,66,50,34,58,62,,36,28,59,60,54,64,,22,22,17,,7,14,11,16,16,,,,,,,,,1
186481,"Dani Salas, Daniel Salas del Sar",20,57 ,0,Unknown,186522,179,74,,RB,,0,0,,,,,,,,,,,,,,,,,,,,,,,,,,,,,,,,,,,,,,,,,,,,,,,,,,,1
187011,"Y. M'Vila, Yann Gérard M'Vila",34,71 ,71 ,2026,187052,183,80,,CDM,,650000,8000,,,62,59,62,72,56,,66,67,65,69,70,,45,48,53,68,56,,66,66,61,74,67,,75,71,63,70,68,72,,70,70,67,,13,9,16,15,7,,,,,,,,,1
187306,"I. Smolnikov, Igor Smolnikov",29,78 ,78 ,Unknown,187347,178,70,,RB,,0,0,,,,,,,,,,,,,,,,,,,,,,,,,,,,,,,,,,,,,,,,,,,,,,,,,,,1
187875,"M. Olsson, Marcus Jonas Munuhe Olsson",36,62,62,2024,187916,180,68,,LB,,110000,2000,,,,,,,,,,,,,,,,,,,,,,,,,,,,,,,,,,,,,,,,,,,,,,,,,,,0
187997,"O. Čelůstka, Ondřej Čelůstka",35,71 ,71 ,2025,188038,187,83,,CB,,500000,16000,,,,,,,,,,,,,,,,,,,,,,,,,,,,,,,,,,,,,,,,,,,,,,,,,,,1
188050,"F. Gulbrandsen, Fredrik Aasmundrud Gulbrandsen",31,69 ,69 ,2026,188091,176,74,,CF,,1200000,6000,,,,,,,,,,,,,,,,,,,,,,,,,,,,,,,,,,,,,,,,,,,,,,,,,,,1
188113,"L. Holtby, Lewis Harry Holtby",33,72 ,72 ,2025,188154,176,76,,CAM,,1400000,20000,,,,,,,,,,,,,,,,,,,,,,,,,,,,,,,,,,,,,,,,,,,,,,,,,,,0
188224,"Guarú, Alexandre Gomes da Silva",27,65 ,70 ,Unknown,188265,168,70,,CF,,0,0,,,,,,,,,,,,,,,,,,,,,,,,,,,,,,,,,,,,,,,,,,,,,,,,,,,0
188227,"L. Acosta, Lautaro Germán Acosta",36,72 ,72 ,2025,188268,169,65,,RW,,750000,11000,,,,,,,,,,,,,,,,,,,,,,,,,,,,,,,,,,,,,,,,,,,,,,,,,,,1
188483,"V. Babacan, Volkan Babacan",35,70 ,70 ,2025,188524,192,86,,GK,,180000,5000,,,,,,,,,,,,,,,,,,,,,,,,,,,,,,,,,,,,,,,,,,,,,,,,,,,1
188497,"V. Sasso, Vincent Julien Sasso",33,71 ,71 ,2025,188538,190,83,,CB,,900000,6000,,,47,22,78,67,26,,52,37,26,62,58,,35,38,36,65,43,,40,77,66,82,21,,78,68,22,32,41,60,,71,72,69,,11,11,12,7,8,,,,,,,,,1
188559,"M. Abeid, Mehdi Abeidمهدي عبيد",31,71 ,71 ,2025,188600,178,77,,CDM,,1300000,17000,,,,,,,,,,,,,,,,,,,,,,,,,,,,,,,,,,,,,,,,,,,,,,,,,,,1
188762,"Taison, Taison Barcellos Freda",36,75 ,75 ,2025,188803,172,67,,RW,,1800000,22000,,,,,,,,,,,,,,,,,,,,,,,,,,,,,,,,,,,,,,,,,,,,,,,,,,,1
188799,"Miguel Lopes, Hugo Miguel de Almeida Costa Lopes",37,70 ,70 ,2025,188840,183,83,,CB,,275000,5000,,,,,,,,,,,,,,,,,,,,,,,,,,,,,,,,,,,,,,,,,,,,,,,,,,,1
189126,"A. Gunnarsson, Aron Einar Malmquist Gunnarsson",35,67 ,67 ,Unknown,189167,177,85,,CDM,,0,0,,,,,,,,,,,,,,,,,,,,,,,,,,,,,,,,,,,,,,,,,,,,,,,,,,,1
189180,"João Aurélio, João Miguel Coimbra Aurélio",35,67,67,2025,189221,182,74,,RB,,375000,6000,,,,,,,,,,,,,,,,,,,,,,,,,,,,,,,,,,,,,,,,,,,,,,,,,,,1
189256,"Daniel Lopes, Daniel Lopes Dos Santos",24,63 ,69 ,Unknown,189297,174,67,,CF,,0,0,,,,,,,,,,,,,,,,,,,,,,,,,,,,,,,,,,,,,,,,,,,,,,,,,,,0
189283,"A. McCarthy, Alex Simon McCarthy",34,71 ,71 ,2026,189324,193,79,,GK,,325000,26000,,,,,,,,,,,,,,,,,,,,,,,,,,,,,,,,,,,,,,,,,,,,,,,,,,,1
189346,"T. Mickel, Tom Mickel",35,63 ,63 ,2025,189387,185,84,,GK,,50000,7000,,,,,,,,,,,,,,,,,,,,,,,,,,,,,,,,,,,,,,,,,,,,,,,,,,,1
189421,"J. Hoilett, David Junior Wayne Hoilett",34,69,69,2025,189462,175,69,,LM,,750000,7000,,,,,,,,,,,,,,,,,,,,,,,,,,,,,,,,,,,,,,,,,,,,,,,,,,,1
189441,"Ríos Reina, José Antonio Ríos Reina",34,67 ,67 ,2025,189482,180,78,,LB,,375000,7000,,,,,,,,,,,,,,,,,,,,,,,,,,,,,,,,,,,,,,,,,,,,,,,,,,,0
189470,"Sergio Busquets, Sergio Busquets Burgos",35,81 ,81 ,2025,189511,189,76,,CDM,,7500000,10000,,,,,,,,,,,,,,,,,,,,,,,,,,,,,,,,,,,,,,,,,,,,,,,,,,,1
189519,"Iborra, Vicente Iborra de la Fuente",36,72,72,2025,189560,190,80,,CDM,,600000,8000,,,,,,,,,,,,,,,,,,,,,,,,,,,,,,,,,,,,,,,,,,,,,,,,,,,1
189641,"B. Mee, Benjamin Thomas Mee",34,76 ,76 ,2025,189682,180,82,,CB,,2400000,60000,,,,,,,,,,,,,,,,,,,,,,,,,,,,,,,,,,,,,,,,,,,,,,,,,,,0
189792,"R. Tait, Richard Neil Peter Tait",32,62 ,62 ,2023,189833,179,77,,RB,,275000,1000,,,,,,,,,,,,,,,,,,,,,,,,,,,,,,,,,,,,,,,,,,,,,,,,,,,1
190099,"A. White, Aidan Peter White",30,59 ,59 ,2023,190140,175,61,,LB,,190000,2000,,,,,,,,,,,,,,,,,,,,,,,,,,,,,,,,,,,,,,,,,,,,,,,,,,,0
190137,"N. Gunnarsson, Niklas Gunnarsson",33,64 ,64 ,2025,190178,188,80,,CB,,275000,6000,,,,,,,,,,,,,,,,,,,,,,,,,,,,,,,,,,,,,,,,,,,,,,,,,,,1
190158,"Óscar Sielva, Óscar Sielva Moreno",32,73 ,73 ,2026,190199,178,78,,CM,,2400000,10000,,,,,,,,,,,,,,,,,,,,,,,,,,,,,,,,,,,,,,,,,,,,,,,,,,,1
190418,"A. Hansen, André Hansen",34,69 ,69 ,2025,190459,194,87,,GK,,240000,3000,,,,,,,,,,,,,,,,,,,,,,,,,,,,,,,,,,,,,,,,,,,,,,,,,,,1
2791,"K. Glik, Kamil Jacek Glik",36,66 ,66 ,2025,190547,190,80,66,CB,0,150000,5000,€311K,206,,,,,,228,,,,,,208,,,,,,291,,,,,,222,,,,,,,189,,,,47,,,,,,1391,299,3,32,32,43,53,64,1
190552,"D. Aleksić, Danijel AleksićДaниjeл Aлeкcић",33,71 ,71 ,2026,190593,182,75,,CAM,,1200000,15000,,,,,,,,,,,,,,,,,,,,,,,,,,,,,,,,,,,,,,,,,,,,,,,,,,,0
190811,"C. McManaman, Callum Henry McManaman",33,62 ,62 ,2025,190852,175,73,,RM,,250000,9000,,,57,59,36,63,55,,63,51,54,51,62,,63,69,80,56,72,,63,51,53,60,56,,71,29,61,62,59,62,,30,29,29,,10,13,15,14,10,,,,,,,,,1
190931,"E. Salvio, Eduardo Antonio Salvio",33,75 ,75 ,2026,190972,173,71,,RW,,3500000,19000,,,,,,,,,,,,,,,,,,,,,,,,,,,,,,,,,,,,,,,,,,,,,,,,,,,1
191112,"M. Sandberg, Robert Marcus Sandberg",33,65 ,65 ,2024,191153,191,83,,GK,,230000,2000,,,,,,,,,,,,,,,,,,,,,,,,,,,,,,,,,,,,,,,,,,,,,,,,,,,1
191487,"Hou Sen, Hou Sen侯森",35,65,65,2027,191528,191,85,,GK,,90000,5000,,,,,,,,,,,,,,,,,,,,,,,,,,,,,,,,,,,,,,,,,,,,,,,,,,,1
191531,"Zheng Zheng, Zheng Zheng郑铮",34,66,66,2026,191572,185,77,,CB,,325000,15000,,,,,,,,,,,,,,,,,,,,,,,,,,,,,,,,,,,,,,,,,,,,,,,,,,,0
191586,"M. Rits, Mats Rits",30,74 ,74 ,2026,191627,178,73,,CDM,,3500000,25000,,,,,,,,,,,,,,,,,,,,,,,,,,,,,,,,,,,,,,,,,,,,,,,,,,,1
191587,"L. Chichizola, Leandro Chichizola",34,72 ,72 ,2025,191628,185,80,,GK,,400000,3000,,,,,,,,,,,,,,,,,,,,,,,,,,,,,,,,,,,,,,,,,,,,,,,,,,,1
191607,"M. Yoshida, Maya Yoshida吉田 麻也",35,72 ,72 ,2026,191648,189,90,,CB,,625000,6000,,,,,,,,,,,,,,,,,,,,,,,,,,,,,,,,,,,,,,,,,,,,,,,,,,,1
191689,"S. Rafn, Simen Rafn",32,64 ,64 ,2025,191730,172,70,,RB,,400000,3000,,,,,,,,,,,,,,,,,,,,,,,,,,,,,,,,,,,,,,,,,,,,,,,,,,,1
191816,"Yang Yun, Yang Yun杨云",35,62 ,62 ,2024,191857,185,75,,CB,,110000,5000,,,,,,,,,,,,,,,,,,,,,,,,,,,,,,,,,,,,,,,,,,,,,,,,,,,1
191830,"Lee Yong Rae, Yong-rae Lee이용래 李容来",38,65 ,65 ,2024,191871,175,71,,CM,,230000,5000,,,,,,,,,,,,,,,,,,,,,,,,,,,,,,,,,,,,,,,,,,,,,,,,,,,0
192061,"N. Hult, Bo Niklas Hult",34,71,71,2025,192102,173,63,,LB,,575000,5000,,,,,,,,,,,,,,,,,,,,,,,,,,,,,,,,,,,,,,,,,,,,,,,,,,,0
192079,"Geng Xiaofeng, Geng Xiaofeng耿晓峰",36,58 ,58 ,2025,192120,191,82,,GK,,25000,5000,,,,,,,,,,,,,,,,,,,,,,,,,,,,,,,,,,,,,,,,,,,,,,,,,,,1
192209,"M. Jurman, Matthew Jurman",34,62 ,62 ,2025,192250,190,85,,CB,,130000,4000,,,,,,,,,,,,,,,,,,,,,,,,,,,,,,,,,,,,,,,,,,,,,,,,,,,0
192278,"L. Garbutt, Luke Samuel Garbutt",31,66,66,2025,192319,179,73,,LB,,525000,11000,,,,,,,,,,,,,,,,,,,,,,,,,,,,,,,,,,,,,,,,,,,,,,,,,,,0
192301,"E. Cardona, Edwin Andrés Cardona Bedoya",31,73 ,73 ,2027,192342,183,92,,CAM,,2500000,6000,,,,,,,,,,,,,,,,,,,,,,,,,,,,,,,,,,,,,,,,,,,,,,,,,,,1
192581,"S. Duffy, Shane Patrick Michael Duffy",32,73 ,73 ,2026,192622,193,76,,CB,,2000000,28000,,,38,40,80,60,30,,45,37,33,60,52,,33,34,32,68,36,,62,77,59,83,49,,83,72,58,41,45,59,,74,73,70,,9,11,16,8,12,,,,,,,,,1
2057,"Marcos Alonso, Marcos Alonso Mendoza",33,78 ,78 ,2025,192638,188,84,78,LB,0,7500000,30000,€19.5M,397,83,70,79,82,76,404,76,84,83,75,79,302,63,59,64,78,56,387,82,80,75,73,75,365,75,76,77,74,63,79,234,72,81,80,50,9,7,13,9,12,2139,433,2,50,74,81,76,78,0
2798,"C. Tosun, Cenk Tosun",33,74 ,74 ,2026,192991,183,78,74,CF,0,2700000,43000,€6.5M,362,,,,,,354,,,,,,339,,,,,,370,,,,,,323,,,,,,,82,,,,59,,,,,,1889,386,2,66,75,67,71,36,1
193039,"De Gea, David de Gea Quintana",33,86,86,2025,193080,192,76,,GK,,17500000,55000,,,,,,,,,,,,,,,,,,,,,,,,,,,,,,,,,,,,,,,,,,,,,,,,,,,1
193050,"B. Nuytinck, Bram Nuytinck",34,70,70,2026,193091,190,82,,CB,,600000,10000,,,34,32,71,63,40,,54,51,34,61,56,,46,34,53,66,55,,62,67,58,80,36,,77,68,34,51,46,73,,73,74,70,,7,6,10,12,9,,,,,,,,,0
2800,"M. Rojas, Marco Rodrigo Rojas Walen",32,67 ,67 ,2025,193092,168,64,69,CAM,0,800000,4000,€1.5M,289,60,65,55,66,65,344,70,67,62,59,69,384,76,75,83,64,82,258,66,54,40,30,65,286,49,43,65,66,57,67,141,45,45,39,44,8,8,7,9,12,1746,368,1,77,66,66,73,45,1
193124,"J. Corona, Jesús Manuel Corona Ruíz",30,80 ,80 ,Unknown,193165,173,66,,RM,,0,0,,,,,,,,,,,,,,,,,,,,,,,,,,,,,,,,,,,,,,,,,,,,,,,,,,,1
193231,"S. Şahin-Radlinger, Samuel Sahin-Radlinger",31,71 ,71 ,2026,193272,196,94,,GK,,1000000,9000,,,,,,,,,,,,,,,,,,,,,,,,,,,,,,,,,,,,,,,,,,,,,,,,,,,1
193303,"P. Schürpf, Pascal Schürpf",34,63 ,63 ,2025,193344,190,85,,CF,,230000,11000,,,,,,,,,,,,,,,,,,,,,,,,,,,,,,,,,,,,,,,,,,,,,,,,,,,0
193317,"Romário, Romário Pereira Sipião",38,65 ,65 ,2025,193358,173,72,,CM,,230000,3000,,,59,53,33,69,62,,72,66,63,63,72,,57,36,87,67,87,,71,49,78,60,62,,77,57,51,67,68,74,,53,40,34,,15,10,16,9,15,,,,,,,,,1
193437,"J. Grimes, Jamie Neil Grimes",33,62 ,62 ,2025,193478,188,83,,CB,,190000,13000,,,,,,,,,,,,,,,,,,,,,,,,,,,,,,,,,,,,,,,,,,,,,,,,,,,0
193543,"G. Burgstaller, Guido Burgstaller",35,71 ,71 ,2025,193584,187,80,,CF,,800000,15000,,,,,,,,,,,,,,,,,,,,,,,,,,,,,,,,,,,,,,,,,,,,,,,,,,,1
193567,"O. Clarke, Oliver Anthony Clarke",32,62 ,62 ,2026,193608,180,86,,CM,,325000,9000,,,,,,,,,,,,,,,,,,,,,,,,,,,,,,,,,,,,,,,,,,,,,,,,,,,1
193885,"B. Singh Junior, Baldeep Singh",25,52 ,58 ,Unknown,193926,180,76,,CB,,0,0,,,,,,,,,,,,,,,,,,,,,,,,,,,,,,,,,,,,,,,,,,,,,,,,,,,1
193904,"N. Uysal, Necip Uysal",33,69 ,69 ,2025,193945,180,72,,CB,,675000,30000,,,,,,,,,,,,,,,,,,,,,,,,,,,,,,,,,,,,,,,,,,,,,,,,,,,1
194018,"M. Chrapek, Michał Łukasz Chrapek",32,65 ,65 ,2026,194059,177,74,,CM,,575000,7000,,,,,,,,,,,,,,,,,,,,,,,,,,,,,,,,,,,,,,,,,,,,,,,,,,,1
194108,"F. Ulvestad, Fredrik Stensøe Ulvestad",32,69 ,69 ,2026,194149,183,84,,CM,,1100000,5000,,,,,,,,,,,,,,,,,,,,,,,,,,,,,,,,,,,,,,,,,,,,,,,,,,,1
194331,"E. Taşkıran, Mahmut Ertuğrul Taşkıran",34,69,69,2025,194372,191,83,,GK,,210000,7000,,,,,,,,,,,,,,,,,,,,,,,,,,,,,,,,,,,,,,,,,,,,,,,,,,,1
